{"$schema":"https://json-schema.org/draft/2020-12/schema","type":"object","additionalProperties":false,"required":["schema_version","split","dataset_label","reports"],"properties":{"schema_version":{"const":1},"split":{"const":"HOLDOUT"},"dataset_label":{"const":"SYNTHETIC"},"reports":{"type":"object","minProperties":2,"additionalProperties":{"$ref":"benchmark-report.v1.schema.json"}}}}
