{"schema_version":1,"split":"HOLDOUT","dataset_label":"SYNTHETIC","reports":{"blob":{"dataset_label":"SYNTHETIC","samples":2,"true_positive":0,"false_positive":0,"false_negative":1,"true_negative":1,"precision":0.0,"recall":0.0,"center_error_px_mean":0.0,"center_error_px_median":0.0,"center_error_px_max":0.0,"failure_classes":["ZERO_CANDIDATE"]},"circle":{"dataset_label":"SYNTHETIC","samples":2,"true_positive":0,"false_positive":0,"false_negative":1,"true_negative":1,"precision":0.0,"recall":0.0,"center_error_px_mean":0.0,"center_error_px_median":0.0,"center_error_px_max":0.0,"failure_classes":["ZERO_CANDIDATE"]}}}
